{
  "schema_version": "public-view-v1",
  "pack_version": "v1",
  "view_label": "M03",
  "source_class": "microphone",
  "duration_tier": "S",
  "risk_bucket": "high",
  "anomaly_classes": [
    "silence_vad_reference"
  ],
  "input_view": "ordered_segments",
  "ordered_units": [
    {
      "unit_index": 0,
      "text": " ENTITY_004 день! К сожалению, я не властен над шалостьми ENTITY_005 и проблемами соединения в ENTITY_006, но я добавил в версию 0.995 возможность установить ENTITY_002, через которые будут идти все загрузки, а также обращение к ENTITY_001."
    },
    {
      "unit_index": 1,
      "text": " А также я добавил в гайды инструкцию о том, как вручную установить модель ENTITY_003 в приложении."
    },
    {
      "unit_index": 2,
      "text": " ENTITY_007 гайд появился в папке с руководствами, а также я добавил в библиотеку сами модели. Я думаю, что скачать их с email облака не должно быть проблемой."
    },
    {
      "unit_index": 3,
      "text": " Очень жаль, что вы столкнулись с таким большим количеством трудностей. Я постараюсь вам помочь, если будут вопросы, чтобы вы смогли установить эту модель и попробовать ее работу в приложении."
    },
    {
      "unit_index": 4,
      "text": " Сам ресурс HuggingFace не объявлял санкции к ENTITY_006, так что это исключительно внутренние региональные проблемы, к моему сожалению."
    }
  ],
  "public_structure_sha256": "3fc4cdfbff7c9e4c68bf12860836f47d46445dbf3d0d073572757787ffa7757f",
  "provenance_claims": [
    "RAW_SEGMENT_EXACT",
    "RAW_BLOCK_EXACT",
    "CHUNK_MAP_EXACT",
    "REFERENCE_ONLY"
  ],
  "semantic_gold_status": "reference_candidate",
  "media_resolution": "unresolved"
}
