{
  "schema_version": "public-view-v1",
  "pack_version": "v1",
  "view_label": "M08",
  "source_class": "microphone",
  "duration_tier": "S",
  "risk_bucket": "high",
  "anomaly_classes": [
    "punctuation_casing",
    "omission_reference"
  ],
  "input_view": "ordered_segments",
  "ordered_units": [
    {
      "unit_index": 0,
      "text": " модель это ответ на вопрос потенциального покупателя начни с собачки и ее никнейма добрый день как я говорю своим студентам нет глупых вопросов есть не заданное все так программа действительно устанавливается на компьютер через стандартный установщик как это происходит и во многих других программах поддерживается исключительно windows 11 на десятке я не уверен как это будет работать"
    },
    {
      "unit_index": 1,
      "text": " серверную windows мы не поддерживаем по большому счету программа имеет два основных функционала это диктовка под курсор наподобие той который я сейчас пишу этот ответ и"
    },
    {
      "unit_index": 2,
      "text": " там есть несколько разных настроек которые позволяют делать эту работу более качественно и более интересно и второй функционал это действительно возможность достать текст из любых видео и"
    },
    {
      "unit_index": 3,
      "text": " и аудио и на текущий момент уже и из изображений и получить описание изображений из вашего локального компьютера это важно"
    },
    {
      "unit_index": 4,
      "text": " из интернета доставать видео вы будете сами хотя сейчас за отзыв я предоставляю инструмент который помогает массово выгружать видео из ютуба"
    },
    {
      "unit_index": 5,
      "text": " после того как программа обработает ваши материалы при наличии мощного компьютера это может быть исключительно локальная работа без отправки данных куда-либо в интернет и в целом совершенно бесплатно"
    },
    {
      "unit_index": 6,
      "text": " если мощного компьютера с хорошей видеокарты нет одна из самых ресурсоемких и дорогих операций это извлечение аудио и превращение его в текст все равно будет происходить на вашем компьютере а вот"
    },
    {
      "unit_index": 7,
      "text": " постобработка текста нейросетью когда происходит расстановка знаков припинания слова перези это исчезают возможно перевод на другой язык что программа также отлично делает"
    },
    {
      "unit_index": 8,
      "text": " включая создание идеально синхронизированных тайм кодов для видео это будет происходить уже через облачные нейросети за деньги то есть вам потребуется"
    },
    {
      "unit_index": 9,
      "text": " тратить деньги но на текущий момент мы поддерживаем также и"
    },
    {
      "unit_index": 10,
      "text": " одного из российских посредников где можно просто платить за рубли и не будет конской наценки"
    },
    {
      "unit_index": 11,
      "text": " внутри программы есть плеер и вы можете смотреть видео прямо там с"
    },
    {
      "unit_index": 12,
      "text": " постобработанными"
    },
    {
      "unit_index": 13,
      "text": " субтитрами и это очень удобно когда вам нужно перевести"
    },
    {
      "unit_index": 14,
      "text": " видео с какого-то языка на русский в целом программа представить представляет собой модул контент протокол"
    },
    {
      "unit_index": 15,
      "text": " сервер и вы можете подключить локального агента который работает у вас на компьютере"
    },
    {
      "unit_index": 16,
      "text": " он будет пользоваться всеми этими инструментами и сможет извлекать материалы"
    },
    {
      "unit_index": 17,
      "text": " которые ему нужно из ваших видео и аудио"
    },
    {
      "unit_index": 18,
      "text": " анализировать с ним их и как-то с ними работать"
    },
    {
      "unit_index": 19,
      "text": " но также вы сами сможете пользоваться поиском по программе и с ней работать руками если захотите"
    }
  ],
  "public_structure_sha256": "9d510c09e6de0d09f21413462fb6007efe41d1c437f13b3dfdf655ed43747080",
  "provenance_claims": [
    "RAW_SEGMENT_EXACT",
    "RAW_BLOCK_EXACT",
    "CHUNK_MAP_EXACT",
    "REFERENCE_ONLY"
  ],
  "semantic_gold_status": "reference_candidate",
  "media_resolution": "unresolved"
}
