{
  "schema_version": "public-view-v1",
  "pack_version": "v1",
  "view_label": "M11",
  "source_class": "microphone",
  "duration_tier": "S",
  "risk_bucket": "high",
  "anomaly_classes": [
    "raw_only"
  ],
  "input_view": "ordered_segments",
  "ordered_units": [
    {
      "unit_index": 0,
      "text": " Итак, здесь бы я хотел основной упор сделать, наверное, больше на писателя архитектурного сериала, это техническая документация, в которую будет интересно, возможно, погружаться, изучать, там, если, ну, было бы неплохо искать подобные выпуски, где мы работали уже над этим, особенно если я говорю, что мы над этим работали, да, модели, давать на них ссылки, во-первых,"
    },
    {
      "unit_index": 1,
      "text": " во-вторых, это строгая иерархия, один общий ритми, который описывает каждый сезон, у каждого сезона свой ритми, свой, своя папка, и там идут эти выпуски, обычно это 300, 400, 500, 600 строк, где простым языком поясняются концепции, которые были применены, используются мэрмэ, диаграммы классов, последовательности,"
    },
    {
      "unit_index": 2,
      "text": " вот эти вот структурные, по-моему, они называются flowcard, если я не ошибаюсь, диаграммы, пояснения даются, что, как, зачем, для чего мы делали, но не пишется код, да, то есть именно блоков кода там нет, как таковых, вот какими-то кусками прям,"
    },
    {
      "unit_index": 3,
      "text": " там могут упоминаться классы, там могут даваться диаграммы этих классов, структуры баз данных, но не пишутся, допустим, не цитируются классы, не цитируются файлы миграций,"
    },
    {
      "unit_index": 4,
      "text": " релиз ноут, это, по сути, просто заметка релизе, она формируется превентивно, то есть сейчас пользователи получили версию, допустим, RARE_001,"
    },
    {
      "unit_index": 5,
      "text": " а мы готовим RARE_002, к примеру, да, и потихонечку, по мере продвижения мы пополняем этот релиз ноут,"
    },
    {
      "unit_index": 6,
      "text": " в конце какой-то большой работы, когда мы что-то уже сделали, проверили, или пофиксили, проверили,"
    },
    {
      "unit_index": 7,
      "text": " и мы пишем, да, что вот было сделано вот это, вот это, какое-то сообщение для пользователей,"
    },
    {
      "unit_index": 8,
      "text": " и там он состоит технически из двух частей, ну, ты можешь посмотреть и чуть-чуть его улучшить, возможно,"
    },
    {
      "unit_index": 9,
      "text": " он состоит из двух частей, заметки для нас и отдельный раздел уже для пользователей, то, что можно публиковать будет."
    },
    {
      "unit_index": 10,
      "text": " Момент такой, что модели, бывает, тупят и пишут то, что было, ну, мы что-то сделаем в рамках этого релиза,"
    },
    {
      "unit_index": 11,
      "text": " потом понимаем, что оно не очень хорошо работает, там фиксим, и они пишут, да, сделана фишка А,"
    },
    {
      "unit_index": 12,
      "text": " а потом в фишке А было пофиксено баг."
    },
    {
      "unit_index": 13,
      "text": " Это не надо пользователям, да, то есть, если баг фиксится в рамках того, что было сделано в этом же релизе,"
    },
    {
      "unit_index": 14,
      "text": " который люди еще не получили, ну, этого не надо писать."
    },
    {
      "unit_index": 15,
      "text": " Это можно писать в общей технической части, или даже вообще не писать, для этого и существует архитектурный сериал глобально."
    },
    {
      "unit_index": 16,
      "text": " Сам же сериал пишется по требованию, модели не должны его сами писать,"
    },
    {
      "unit_index": 17,
      "text": " потому что, ну, какие-то вещи достойны того, чтобы это фиксировать, да,"
    },
    {
      "unit_index": 18,
      "text": " какие-то самые мелкие-мелкие глюки."
    },
    {
      "unit_index": 19,
      "text": " ENTITY_001 быть, иногда мы будем возвращаться и дописывать какие-то вещи, да,"
    },
    {
      "unit_index": 20,
      "text": " чуть-чуть редактировать старые выпуски, но в основном это всегда будут новые."
    },
    {
      "unit_index": 21,
      "text": " Спасибо."
    }
  ],
  "public_structure_sha256": "aff398567de11ff1563fb544bd56b2965973982aabb091223d82d018377892c7",
  "provenance_claims": [
    "RAW_SEGMENT_EXACT",
    "RAW_BLOCK_EXACT",
    "CHUNK_MAP_EXACT"
  ],
  "semantic_gold_status": "absent",
  "media_resolution": "unresolved"
}
