{
  "schema_version": "public-view-v1",
  "pack_version": "v1",
  "view_label": "M09",
  "source_class": "microphone",
  "duration_tier": "S",
  "risk_bucket": "high",
  "anomaly_classes": [
    "repetition_reference",
    "hallucination_like_reference",
    "late_loss_reference"
  ],
  "input_view": "ordered_segments",
  "ordered_units": [
    {
      "unit_index": 0,
      "text": " Итак, твоя задача будет создать домашнее задание для группы, которая изучает не программирование, а искусственный интеллект"
    },
    {
      "unit_index": 1,
      "text": " Это общий курс в целом по искусственному интеллекту"
    },
    {
      "unit_index": 2,
      "text": " ENTITY_005 их на сегодня будет номер 1"
    },
    {
      "unit_index": 3,
      "text": " ENTITY_007 у нас DATE_001"
    },
    {
      "unit_index": 4,
      "text": " ENTITY_004 называется, прям так вот пишется большими буквами, ИИ621"
    },
    {
      "unit_index": 5,
      "text": " ENTITY_002 русские буквы, да?"
    },
    {
      "unit_index": 6,
      "text": " Задача их будет следующая"
    },
    {
      "unit_index": 7,
      "text": " ENTITY_006 в чате ENTITY_001"
    },
    {
      "unit_index": 8,
      "text": " И попробовать сделать один и тот же запрос"
    },
    {
      "unit_index": 9,
      "text": " С выключенными инструментами"
    },
    {
      "unit_index": 10,
      "text": " ENTITY_009 с инструментом размышления"
    },
    {
      "unit_index": 11,
      "text": " И с инструментом поиска"
    },
    {
      "unit_index": 12,
      "text": " В домашней работе прислать скриншоты, подтверждающие выполненную работу"
    },
    {
      "unit_index": 13,
      "text": " ENTITY_008, должно быть три скриншота"
    },
    {
      "unit_index": 14,
      "text": " Где будет видно то, что они использовали разные модели"
    },
    {
      "unit_index": 15,
      "text": " Ну, желательно, чтобы видно было размышления модели"
    },
    {
      "unit_index": 16,
      "text": " Где будет видно то, что они разные режимы использовали"
    },
    {
      "unit_index": 17,
      "text": " Ну, желательно, желательно, желательно, желательно, желательно, желательно, желательно, желательно, желательно, желательно, желательно, желательно, желательно, желательно, желательно, желательно, желательно, желательно, желательно, желательно, желательно, желательно, желательно, желательно, желательно, желательно, желательно, желательно, желательно, желательно, желательно, желательно, желательно, желательно, желательно, желательно, желательно, желательно, желательно, желательно, желательно, желательно, желательно, желательно, желательно, желательно, желательно, желательно, желательно."
    }
  ],
  "public_structure_sha256": "6e2cb1f4b3cb707393653fad0a6e6c00ffe563506ea1a5faa98b2febbf55e155",
  "provenance_claims": [
    "RAW_SEGMENT_EXACT",
    "RAW_BLOCK_EXACT",
    "CHUNK_MAP_EXACT",
    "REFERENCE_ONLY"
  ],
  "semantic_gold_status": "reference_candidate",
  "media_resolution": "unresolved"
}
