{
  "schema_version": "public-view-v1",
  "pack_version": "v1",
  "view_label": "M02",
  "source_class": "microphone",
  "duration_tier": "S",
  "risk_bucket": "medium",
  "anomaly_classes": [
    "omission_reference"
  ],
  "input_view": "ordered_segments",
  "ordered_units": [
    {
      "unit_index": 0,
      "text": " Итак, давай пройдемся с тобой по окнам. Ты отчитался о полном успешном успехе, что все работает и я здесь сразу же вижу кучу проблем. ENTITY_002 начнем с первого окна, конструктор. Я не вижу здесь прогнозируемой цены. Я понимаю, что цену трудно спрогнозировать, когда подаются ассеты в изображении, хотя технически возможно, думаю, ну наверное это возможно технически."
    },
    {
      "unit_index": 1,
      "text": " Но я хотел бы видеть хотя бы предварительную примерную цену, исходя из нашего файла, где полностью сетка цен во всех качествах, размерах и для всех моделей есть. И для всех поставщиков. Это прям не очень хорошо. Это во-первых. Во-вторых, я нажимаю кнопку импорт и я получаю импорт ассетов, но он не работает."
    },
    {
      "unit_index": 2,
      "text": " Я фактически получаю какие-то затычки, заглушки, демо ассет номер 1, номер 2 и далее так. То есть я не могу добавить изображение из базы данных, которые я же уже сгенерировал. Это поганенько достаточно."
    },
    {
      "unit_index": 3,
      "text": " Во-вторых, если посмотреть на сам макет приложения, то я вижу здесь разделение во вкладке конструктор на две половины. При этом задействована только левая, правая пустая."
    },
    {
      "unit_index": 4,
      "text": " Возможно, в ней предполагается перечень ассетов или чего-то еще, или это просто такой косяк в верстке."
    },
    {
      "unit_index": 5,
      "text": " ENTITY_003, конечно же, я хотел бы иметь возможность импортировать ассеты и чтобы в карточках ассетов, которые добавятся, я видел какую-то о них информацию."
    },
    {
      "unit_index": 6,
      "text": " Это было бы интересно."
    },
    {
      "unit_index": 7,
      "text": " ENTITY_005 говорить про вкладку очередь, то проблема здесь следующего характера."
    },
    {
      "unit_index": 8,
      "text": " Я не могу перезапустить очередь."
    },
    {
      "unit_index": 9,
      "text": " Ну, допустим, я забыл добавить ключ от поставщика."
    },
    {
      "unit_index": 10,
      "text": " ENTITY_010 упала с ошибкой."
    },
    {
      "unit_index": 11,
      "text": " Я пошел добавил ключ от поставщика и просто ни одна кнопка не работает."
    },
    {
      "unit_index": 12,
      "text": " ENTITY_009 все, запустить все, вообще ничего не работает."
    },
    {
      "unit_index": 13,
      "text": " При этом, когда очередь отработали, эти кнопки тоже остаются нерабочие."
    },
    {
      "unit_index": 14,
      "text": " Вот у меня есть одна очередь, которая закончилась успехом, одна провалом."
    },
    {
      "unit_index": 15,
      "text": " Ничего эти кнопки не делают."
    },
    {
      "unit_index": 16,
      "text": " Это косяк."
    },
    {
      "unit_index": 17,
      "text": " Идем дальше."
    },
    {
      "unit_index": 18,
      "text": " Галерея."
    },
    {
      "unit_index": 19,
      "text": " Вопросов здесь, в принципе, нет."
    },
    {
      "unit_index": 20,
      "text": " Карточки прикольные."
    },
    {
      "unit_index": 21,
      "text": " Единственное, что, конечно, хотелось бы иметь возможность открыть картинку на весь экран."
    },
    {
      "unit_index": 22,
      "text": " Или же сделать детали результата крупнее."
    },
    {
      "unit_index": 23,
      "text": " Еще я заметил, что, да, ты молодец, ты убрал электрон меню, которое было на английском языке, сверху."
    },
    {
      "unit_index": 24,
      "text": " Но при этом ты вместе с этим убрал возможность просто нажать ENTITY_001+, ENTITY_001- и сделать приложение чуть крупнее, чуть меньше по масштабу."
    },
    {
      "unit_index": 25,
      "text": " Сейчас некоторые элементы кажутся мелковатыми и не совсем читаемы."
    },
    {
      "unit_index": 26,
      "text": " В общем, интерфейс выглядит достаточно минималистично, я бы сказал, чересчур."
    },
    {
      "unit_index": 27,
      "text": " И это даже еще не минимально жизнеспособный продукт, потому что главный функционал генерации картинок с ассетами, по сути, сейчас не работает."
    },
    {
      "unit_index": 28,
      "text": " А еще я бы хотел, чтобы ты точно убедился в том, что в галерее я смогу увидеть карточки и простым способом увидеть ассеты, на которых это изображение было сделано."
    },
    {
      "unit_index": 29,
      "text": " Допустим, в деталях результата или же даже какими-то маленькими квадратиками прямо внизу карточки с изображением."
    },
    {
      "unit_index": 30,
      "text": " В общем, я хочу, чтобы ты запустил серию подагентов, точечно собрал всю информацию и выписал еще один документ-план в документацию, где бы описал полностью все этапы работ, включая тесты, генерации скриншотов, самопроверки и прочее."
    },
    {
      "unit_index": 31,
      "text": " Также, конечно же, чтобы ты описал, если какие-то работы можно делать параллельно, чтобы можно было запускать несколько агентов работу, чтобы они работали над разными частями приложения."
    }
  ],
  "public_structure_sha256": "aa05caa5a357cf27fe486dd1d539b7de449b075af14e7a8eed90e67d3d4d5235",
  "provenance_claims": [
    "RAW_SEGMENT_EXACT",
    "RAW_BLOCK_EXACT",
    "CHUNK_MAP_EXACT",
    "REFERENCE_ONLY"
  ],
  "semantic_gold_status": "reference_candidate",
  "media_resolution": "unresolved"
}
