{
  "schema_version": "public-view-v1",
  "pack_version": "v1",
  "view_label": "M05",
  "source_class": "microphone",
  "duration_tier": "S",
  "risk_bucket": "high",
  "anomaly_classes": [
    "repetition_reference",
    "hallucination_like_reference",
    "late_loss_reference"
  ],
  "input_view": "ordered_segments",
  "ordered_units": [
    {
      "unit_index": 0,
      "text": " Тут будет важно вычитать предыдущие заметки по релизам, полностью вычитать навык, посмотреть заметки архитектурные сезон 9 и сезон 8, понять, что было в последней релизной версии, которая выходила, это RARE_001, собственно, сместить версию релиза в сборке и описать нормальный релиз, но со ссылками на серии архитектурного сериала,"
    },
    {
      "unit_index": 1,
      "text": " соответственно, как обычно, как положено, техническая часть и заметки для пользователей, но без фанатизма, там должно быть все четко, ясно, кратко и понятно"
    },
    {
      "unit_index": 2,
      "text": " я вот не помню вообще, что мы пользователям давали, очереди, по-моему, только давали, да, картинки еще как будто бы не давали"
    },
    {
      "unit_index": 3,
      "text": " в общем, действуй пошагово, выясни, что еще не давали, составь список обновлений, изменений, да, и сделай релиз ноут"
    },
    {
      "unit_index": 4,
      "text": " и первым делом, наверное, обнови, самым первым делом обнови версию в программе, чтобы я прямо сейчас мог запустить билд"
    },
    {
      "unit_index": 5,
      "text": " напиши об этом в чат, а потом уже продолжай, вычитывай скилл, документацию, прошлые релиз ноуты, собирай всю информацию и пиши"
    },
    {
      "unit_index": 6,
      "text": " о том, что все, что все, что все, что все, что все, что все, что все, что все, что все, что все, что все, что все, что все, что все, что все, что все, что все, что все, что все, что все, что все, что все, что все, что все, что все, что все, что все, что все, что все, что все, что все, что все, что все, что все, что все, что все, что все, что все, что все, что все, что все, что все, что все, что все, что все, что все, что все, что все, что все, что все, что все, что все, что все, что все, что все, что все, что все, что все, что все, что все, что все, что все, что все, что все, что все, что все, что все, что все, что все, что все, что все, что все, что все"
    }
  ],
  "public_structure_sha256": "b500d56b7cfb9a5f44992e52ff6009344fb57f659eea24f3553720cc83877fe5",
  "provenance_claims": [
    "RAW_SEGMENT_EXACT",
    "RAW_BLOCK_EXACT",
    "CHUNK_MAP_EXACT",
    "REFERENCE_ONLY"
  ],
  "semantic_gold_status": "reference_candidate",
  "media_resolution": "unresolved"
}
